{
  "$schema": "https://json-schema.org/draft/2020-12/schema",
  "$id": "https://agentforge.dev/contracts/events/agent-run.cancel-requested.v1.schema.json",
  "title": "AgentRun cancellation requested event v1",
  "type": "object", "additionalProperties": false,
  "required": ["eventId","eventType","schemaVersion","occurredAt","producer","tenantId","projectId","runId","aggregateType","aggregateId","aggregateVersion","correlationId","causationId","payload"],
  "properties": {
    "eventId": { "$ref": "#/$defs/uuidV7" }, "eventType": { "const": "agent-run.cancel-requested.v1" },
    "schemaVersion": { "const": 1 }, "occurredAt": { "type": "string", "format": "date-time" },
    "producer": { "const": "platform-api" }, "tenantId": { "$ref": "#/$defs/uuidV7" },
    "projectId": { "$ref": "#/$defs/uuidV7" }, "runId": { "$ref": "#/$defs/uuidV7" },
    "aggregateType": { "const": "AgentRun" }, "aggregateId": { "$ref": "#/$defs/uuidV7" },
    "aggregateVersion": { "type": "integer", "minimum": 2 },
    "requestId": { "type": "string", "minLength": 1, "maxLength": 128 },
    "traceparent": { "type": "string", "pattern": "^[0-9a-f]{2}-[0-9a-f]{32}-[0-9a-f]{16}-[0-9a-f]{2}$" },
    "tracestate": { "type": "string", "minLength": 1, "maxLength": 512 },
    "correlationId": { "type": "string", "minLength": 1, "maxLength": 255 },
    "causationId": { "type": "string", "minLength": 1, "maxLength": 255 },
    "payload": { "type": "object", "additionalProperties": false,
      "required": ["projectId","runId","status","attemptNumber","requestedBy","commandId"],
      "properties": {
        "projectId": { "$ref": "#/$defs/uuidV7" }, "runId": { "$ref": "#/$defs/uuidV7" },
        "status": { "const": "CANCELLING" }, "attemptNumber": { "type": "integer", "minimum": 1 },
        "requestedBy": { "type": "string", "minLength": 1, "maxLength": 255 },
        "commandId": { "type": "string", "minLength": 1, "maxLength": 255 }
      }
    }
  },
  "$defs": { "uuidV7": { "type": "string", "pattern": "^[0-9a-f]{8}-[0-9a-f]{4}-7[0-9a-f]{3}-[89ab][0-9a-f]{3}-[0-9a-f]{12}$" } }
}
