{"eventId":"019b0000-0000-7000-8000-000000000014","eventType":"agent-run.cancel-requested.v1","schemaVersion":1,"occurredAt":"2026-07-27T09:00:00Z","producer":"platform-api","tenantId":"019b0000-0000-7000-8000-000000000002","projectId":"019b0000-0000-7000-8000-000000000003","runId":"019b0000-0000-7000-8000-000000000004","aggregateType":"AgentRun","aggregateId":"019b0000-0000-7000-8000-000000000004","aggregateVersion":2,"correlationId":"cancel-command-1","causationId":"cancel-command-1","payload":{"projectId":"019b0000-0000-7000-8000-000000000003","runId":"019b0000-0000-7000-8000-000000000004","status":"CANCELLING","attemptNumber":1,"requestedBy":"developer@example.test","commandId":"cancel-command-1"}}
